card_type,main_title,body_text,card_image,attr_to_set,right_sets,left_sets,down_sets,swipe_right,swipe_left,swipe_downCard,Character Gender,"Right for Female, Left for Male, Down for Unspecified",no_image,gender,female,male,unspecified,TRUE,TRUE,TRUETextInputScreen,Character First Name,What is your character's first name?,no_image,first_name,,,,,,TextInputScreen,Character Last Name,What is your character's last name?,no_image,last_name,,,,,,TextInputScreen,Character Home Town,What is your character's home town?,no_image,home_town,,,,,,PersonalityGenerator,Character Personality,Select personality traits for your character,no_image,personality,,,,,,PortraitPicker,Character Portrait,Select a portrait for your character,,portrait,,,,,,